{
  "majorCode": "54",
  "majorName": "物联网工程",
  "controlScore": 156,
  "sourceId": "score-segments:2025:54:9e530750ac3a",
  "sourcePdf": "一分一段/原始PDF/2025/54_物联网工程.pdf",
  "sourceSha256": "9e530750ac3a3f2297587390078a74e3a6bc2b28ea37b48b766f0d87dc8f756c",
  "segments": [
    {
      "score": 264,
      "cumulativeCount": 1
    },
    {
      "score": 262,
      "cumulativeCount": 2
    },
    {
      "score": 261,
      "cumulativeCount": 3
    },
    {
      "score": 257,
      "cumulativeCount": 5
    },
    {
      "score": 256,
      "cumulativeCount": 6
    },
    {
      "score": 255,
      "cumulativeCount": 7
    },
    {
      "score": 254,
      "cumulativeCount": 8
    },
    {
      "score": 252,
      "cumulativeCount": 10
    },
    {
      "score": 250,
      "cumulativeCount": 11
    },
    {
      "score": 249,
      "cumulativeCount": 14
    },
    {
      "score": 248,
      "cumulativeCount": 16
    },
    {
      "score": 246,
      "cumulativeCount": 21
    },
    {
      "score": 245,
      "cumulativeCount": 24
    },
    {
      "score": 244,
      "cumulativeCount": 25
    },
    {
      "score": 243,
      "cumulativeCount": 29
    },
    {
      "score": 242,
      "cumulativeCount": 32
    },
    {
      "score": 241,
      "cumulativeCount": 34
    },
    {
      "score": 240,
      "cumulativeCount": 41
    },
    {
      "score": 239,
      "cumulativeCount": 46
    },
    {
      "score": 238,
      "cumulativeCount": 47
    },
    {
      "score": 237,
      "cumulativeCount": 50
    },
    {
      "score": 236,
      "cumulativeCount": 56
    },
    {
      "score": 235,
      "cumulativeCount": 62
    },
    {
      "score": 234,
      "cumulativeCount": 69
    },
    {
      "score": 233,
      "cumulativeCount": 79
    },
    {
      "score": 232,
      "cumulativeCount": 86
    },
    {
      "score": 231,
      "cumulativeCount": 94
    },
    {
      "score": 230,
      "cumulativeCount": 103
    },
    {
      "score": 229,
      "cumulativeCount": 112
    },
    {
      "score": 228,
      "cumulativeCount": 121
    },
    {
      "score": 227,
      "cumulativeCount": 125
    },
    {
      "score": 226,
      "cumulativeCount": 130
    },
    {
      "score": 225,
      "cumulativeCount": 136
    },
    {
      "score": 224,
      "cumulativeCount": 150
    },
    {
      "score": 223,
      "cumulativeCount": 159
    },
    {
      "score": 222,
      "cumulativeCount": 167
    },
    {
      "score": 221,
      "cumulativeCount": 176
    },
    {
      "score": 220,
      "cumulativeCount": 186
    },
    {
      "score": 219,
      "cumulativeCount": 195
    },
    {
      "score": 218,
      "cumulativeCount": 204
    },
    {
      "score": 217,
      "cumulativeCount": 215
    },
    {
      "score": 216,
      "cumulativeCount": 226
    },
    {
      "score": 215,
      "cumulativeCount": 235
    },
    {
      "score": 214,
      "cumulativeCount": 248
    },
    {
      "score": 213,
      "cumulativeCount": 254
    },
    {
      "score": 212,
      "cumulativeCount": 269
    },
    {
      "score": 211,
      "cumulativeCount": 283
    },
    {
      "score": 210,
      "cumulativeCount": 297
    },
    {
      "score": 209,
      "cumulativeCount": 316
    },
    {
      "score": 208,
      "cumulativeCount": 329
    },
    {
      "score": 207,
      "cumulativeCount": 339
    },
    {
      "score": 206,
      "cumulativeCount": 350
    },
    {
      "score": 205,
      "cumulativeCount": 361
    },
    {
      "score": 204,
      "cumulativeCount": 374
    },
    {
      "score": 176,
      "cumulativeCount": 792
    },
    {
      "score": 175,
      "cumulativeCount": 808
    },
    {
      "score": 174,
      "cumulativeCount": 818
    },
    {
      "score": 173,
      "cumulativeCount": 828
    },
    {
      "score": 172,
      "cumulativeCount": 845
    },
    {
      "score": 171,
      "cumulativeCount": 856
    },
    {
      "score": 170,
      "cumulativeCount": 872
    },
    {
      "score": 169,
      "cumulativeCount": 882
    },
    {
      "score": 168,
      "cumulativeCount": 891
    },
    {
      "score": 167,
      "cumulativeCount": 906
    },
    {
      "score": 166,
      "cumulativeCount": 913
    },
    {
      "score": 165,
      "cumulativeCount": 929
    },
    {
      "score": 164,
      "cumulativeCount": 940
    },
    {
      "score": 163,
      "cumulativeCount": 951
    },
    {
      "score": 162,
      "cumulativeCount": 969
    },
    {
      "score": 161,
      "cumulativeCount": 986
    },
    {
      "score": 160,
      "cumulativeCount": 994
    },
    {
      "score": 159,
      "cumulativeCount": 1004
    },
    {
      "score": 158,
      "cumulativeCount": 1018
    },
    {
      "score": 157,
      "cumulativeCount": 1027
    },
    {
      "score": 156,
      "cumulativeCount": 1045
    }
  ],
  "status": "ok",
  "issues": []
}
