{
  "majorCode": "81",
  "majorName": "药学",
  "controlScore": 120,
  "sourceId": "score-segments:2023:81:e954fdff4307",
  "sourcePdf": "一分一段/原始PDF/2023/81_药学.pdf",
  "sourceSha256": "e954fdff4307805531b5fd28b8f131fc9aa4a983080fc69406d7f4378bec6d10",
  "segments": [
    {
      "score": 265,
      "cumulativeCount": 1
    },
    {
      "score": 259,
      "cumulativeCount": 2
    },
    {
      "score": 251,
      "cumulativeCount": 4
    },
    {
      "score": 250,
      "cumulativeCount": 5
    },
    {
      "score": 247,
      "cumulativeCount": 7
    },
    {
      "score": 245,
      "cumulativeCount": 8
    },
    {
      "score": 241,
      "cumulativeCount": 9
    },
    {
      "score": 238,
      "cumulativeCount": 10
    },
    {
      "score": 237,
      "cumulativeCount": 15
    },
    {
      "score": 235,
      "cumulativeCount": 17
    },
    {
      "score": 234,
      "cumulativeCount": 19
    },
    {
      "score": 233,
      "cumulativeCount": 20
    },
    {
      "score": 232,
      "cumulativeCount": 26
    },
    {
      "score": 230,
      "cumulativeCount": 27
    },
    {
      "score": 229,
      "cumulativeCount": 32
    },
    {
      "score": 228,
      "cumulativeCount": 33
    },
    {
      "score": 227,
      "cumulativeCount": 37
    },
    {
      "score": 226,
      "cumulativeCount": 40
    },
    {
      "score": 225,
      "cumulativeCount": 43
    },
    {
      "score": 224,
      "cumulativeCount": 47
    },
    {
      "score": 223,
      "cumulativeCount": 49
    },
    {
      "score": 222,
      "cumulativeCount": 51
    },
    {
      "score": 221,
      "cumulativeCount": 52
    },
    {
      "score": 220,
      "cumulativeCount": 56
    },
    {
      "score": 219,
      "cumulativeCount": 62
    },
    {
      "score": 218,
      "cumulativeCount": 68
    },
    {
      "score": 217,
      "cumulativeCount": 71
    },
    {
      "score": 216,
      "cumulativeCount": 76
    },
    {
      "score": 215,
      "cumulativeCount": 81
    },
    {
      "score": 214,
      "cumulativeCount": 87
    },
    {
      "score": 213,
      "cumulativeCount": 92
    },
    {
      "score": 212,
      "cumulativeCount": 96
    },
    {
      "score": 211,
      "cumulativeCount": 104
    },
    {
      "score": 210,
      "cumulativeCount": 114
    },
    {
      "score": 209,
      "cumulativeCount": 118
    },
    {
      "score": 208,
      "cumulativeCount": 122
    },
    {
      "score": 207,
      "cumulativeCount": 133
    },
    {
      "score": 206,
      "cumulativeCount": 138
    },
    {
      "score": 205,
      "cumulativeCount": 147
    },
    {
      "score": 204,
      "cumulativeCount": 154
    },
    {
      "score": 203,
      "cumulativeCount": 162
    },
    {
      "score": 202,
      "cumulativeCount": 169
    },
    {
      "score": 201,
      "cumulativeCount": 180
    },
    {
      "score": 200,
      "cumulativeCount": 194
    },
    {
      "score": 199,
      "cumulativeCount": 199
    },
    {
      "score": 198,
      "cumulativeCount": 208
    },
    {
      "score": 197,
      "cumulativeCount": 215
    },
    {
      "score": 196,
      "cumulativeCount": 221
    },
    {
      "score": 195,
      "cumulativeCount": 230
    },
    {
      "score": 194,
      "cumulativeCount": 237
    },
    {
      "score": 193,
      "cumulativeCount": 248
    },
    {
      "score": 192,
      "cumulativeCount": 256
    },
    {
      "score": 191,
      "cumulativeCount": 264
    },
    {
      "score": 190,
      "cumulativeCount": 268
    },
    {
      "score": 162,
      "cumulativeCount": 568
    },
    {
      "score": 161,
      "cumulativeCount": 576
    },
    {
      "score": 160,
      "cumulativeCount": 584
    },
    {
      "score": 159,
      "cumulativeCount": 593
    },
    {
      "score": 158,
      "cumulativeCount": 602
    },
    {
      "score": 157,
      "cumulativeCount": 607
    },
    {
      "score": 156,
      "cumulativeCount": 616
    },
    {
      "score": 155,
      "cumulativeCount": 632
    },
    {
      "score": 154,
      "cumulativeCount": 644
    },
    {
      "score": 153,
      "cumulativeCount": 653
    },
    {
      "score": 152,
      "cumulativeCount": 665
    },
    {
      "score": 151,
      "cumulativeCount": 672
    },
    {
      "score": 150,
      "cumulativeCount": 679
    },
    {
      "score": 149,
      "cumulativeCount": 690
    },
    {
      "score": 148,
      "cumulativeCount": 701
    },
    {
      "score": 147,
      "cumulativeCount": 709
    },
    {
      "score": 146,
      "cumulativeCount": 718
    },
    {
      "score": 145,
      "cumulativeCount": 727
    },
    {
      "score": 144,
      "cumulativeCount": 738
    },
    {
      "score": 143,
      "cumulativeCount": 749
    },
    {
      "score": 142,
      "cumulativeCount": 764
    },
    {
      "score": 141,
      "cumulativeCount": 770
    },
    {
      "score": 140,
      "cumulativeCount": 775
    },
    {
      "score": 139,
      "cumulativeCount": 788
    },
    {
      "score": 138,
      "cumulativeCount": 796
    },
    {
      "score": 137,
      "cumulativeCount": 808
    },
    {
      "score": 136,
      "cumulativeCount": 825
    },
    {
      "score": 135,
      "cumulativeCount": 833
    },
    {
      "score": 134,
      "cumulativeCount": 850
    },
    {
      "score": 133,
      "cumulativeCount": 860
    },
    {
      "score": 132,
      "cumulativeCount": 869
    },
    {
      "score": 131,
      "cumulativeCount": 886
    },
    {
      "score": 130,
      "cumulativeCount": 900
    },
    {
      "score": 129,
      "cumulativeCount": 911
    },
    {
      "score": 128,
      "cumulativeCount": 919
    },
    {
      "score": 127,
      "cumulativeCount": 932
    },
    {
      "score": 126,
      "cumulativeCount": 950
    },
    {
      "score": 125,
      "cumulativeCount": 957
    },
    {
      "score": 124,
      "cumulativeCount": 966
    },
    {
      "score": 123,
      "cumulativeCount": 976
    },
    {
      "score": 122,
      "cumulativeCount": 981
    },
    {
      "score": 121,
      "cumulativeCount": 989
    },
    {
      "score": 120,
      "cumulativeCount": 1005
    }
  ],
  "status": "ok",
  "issues": []
}
