{
  "majorCode": "54",
  "majorName": "物联网工程",
  "controlScore": 138,
  "sourceId": "score-segments:2023:54:cfe2d9f5dd57",
  "sourcePdf": "一分一段/原始PDF/2023/54_物联网工程.pdf",
  "sourceSha256": "cfe2d9f5dd570ce5947b21bbae07502ce7981bf86e0b34c0d640c4740f9c127d",
  "segments": [
    {
      "score": 257,
      "cumulativeCount": 1
    },
    {
      "score": 251,
      "cumulativeCount": 2
    },
    {
      "score": 249,
      "cumulativeCount": 3
    },
    {
      "score": 248,
      "cumulativeCount": 4
    },
    {
      "score": 246,
      "cumulativeCount": 5
    },
    {
      "score": 244,
      "cumulativeCount": 7
    },
    {
      "score": 243,
      "cumulativeCount": 8
    },
    {
      "score": 242,
      "cumulativeCount": 9
    },
    {
      "score": 241,
      "cumulativeCount": 11
    },
    {
      "score": 239,
      "cumulativeCount": 13
    },
    {
      "score": 238,
      "cumulativeCount": 14
    },
    {
      "score": 237,
      "cumulativeCount": 15
    },
    {
      "score": 235,
      "cumulativeCount": 17
    },
    {
      "score": 233,
      "cumulativeCount": 23
    },
    {
      "score": 232,
      "cumulativeCount": 26
    },
    {
      "score": 231,
      "cumulativeCount": 29
    },
    {
      "score": 230,
      "cumulativeCount": 32
    },
    {
      "score": 229,
      "cumulativeCount": 40
    },
    {
      "score": 228,
      "cumulativeCount": 51
    },
    {
      "score": 227,
      "cumulativeCount": 57
    },
    {
      "score": 226,
      "cumulativeCount": 62
    },
    {
      "score": 225,
      "cumulativeCount": 68
    },
    {
      "score": 224,
      "cumulativeCount": 76
    },
    {
      "score": 223,
      "cumulativeCount": 82
    },
    {
      "score": 222,
      "cumulativeCount": 95
    },
    {
      "score": 221,
      "cumulativeCount": 101
    },
    {
      "score": 220,
      "cumulativeCount": 106
    },
    {
      "score": 219,
      "cumulativeCount": 113
    },
    {
      "score": 218,
      "cumulativeCount": 120
    },
    {
      "score": 217,
      "cumulativeCount": 128
    },
    {
      "score": 216,
      "cumulativeCount": 148
    },
    {
      "score": 215,
      "cumulativeCount": 149
    },
    {
      "score": 214,
      "cumulativeCount": 156
    },
    {
      "score": 213,
      "cumulativeCount": 165
    },
    {
      "score": 212,
      "cumulativeCount": 173
    },
    {
      "score": 211,
      "cumulativeCount": 187
    },
    {
      "score": 210,
      "cumulativeCount": 196
    },
    {
      "score": 209,
      "cumulativeCount": 204
    },
    {
      "score": 208,
      "cumulativeCount": 217
    },
    {
      "score": 207,
      "cumulativeCount": 233
    },
    {
      "score": 206,
      "cumulativeCount": 243
    },
    {
      "score": 205,
      "cumulativeCount": 253
    },
    {
      "score": 204,
      "cumulativeCount": 262
    },
    {
      "score": 203,
      "cumulativeCount": 282
    },
    {
      "score": 202,
      "cumulativeCount": 294
    },
    {
      "score": 201,
      "cumulativeCount": 300
    },
    {
      "score": 200,
      "cumulativeCount": 312
    },
    {
      "score": 199,
      "cumulativeCount": 327
    },
    {
      "score": 198,
      "cumulativeCount": 341
    },
    {
      "score": 197,
      "cumulativeCount": 351
    },
    {
      "score": 196,
      "cumulativeCount": 376
    },
    {
      "score": 195,
      "cumulativeCount": 396
    },
    {
      "score": 194,
      "cumulativeCount": 411
    },
    {
      "score": 193,
      "cumulativeCount": 429
    },
    {
      "score": 165,
      "cumulativeCount": 444
    },
    {
      "score": 164,
      "cumulativeCount": 973
    },
    {
      "score": 163,
      "cumulativeCount": 987
    },
    {
      "score": 162,
      "cumulativeCount": 1001
    },
    {
      "score": 161,
      "cumulativeCount": 1019
    },
    {
      "score": 160,
      "cumulativeCount": 1032
    },
    {
      "score": 159,
      "cumulativeCount": 1049
    },
    {
      "score": 158,
      "cumulativeCount": 1066
    },
    {
      "score": 157,
      "cumulativeCount": 1085
    },
    {
      "score": 156,
      "cumulativeCount": 1107
    },
    {
      "score": 155,
      "cumulativeCount": 1122
    },
    {
      "score": 154,
      "cumulativeCount": 1141
    },
    {
      "score": 153,
      "cumulativeCount": 1162
    },
    {
      "score": 152,
      "cumulativeCount": 1176
    },
    {
      "score": 151,
      "cumulativeCount": 1193
    },
    {
      "score": 150,
      "cumulativeCount": 1212
    },
    {
      "score": 149,
      "cumulativeCount": 1227
    },
    {
      "score": 148,
      "cumulativeCount": 1239
    },
    {
      "score": 147,
      "cumulativeCount": 1252
    },
    {
      "score": 146,
      "cumulativeCount": 1261
    },
    {
      "score": 145,
      "cumulativeCount": 1281
    },
    {
      "score": 144,
      "cumulativeCount": 1289
    },
    {
      "score": 143,
      "cumulativeCount": 1308
    },
    {
      "score": 142,
      "cumulativeCount": 1319
    },
    {
      "score": 141,
      "cumulativeCount": 1340
    },
    {
      "score": 140,
      "cumulativeCount": 1363
    },
    {
      "score": 139,
      "cumulativeCount": 1375
    },
    {
      "score": 138,
      "cumulativeCount": 1391
    }
  ],
  "status": "ok",
  "issues": []
}
