{
  "majorCode": "S1",
  "majorName": "国际商务",
  "controlScore": 80,
  "sourceId": "score-segments:2025:S1:a4278b1fcd45",
  "sourcePdf": "一分一段/原始PDF/2025/S1_国际商务.pdf",
  "sourceSha256": "a4278b1fcd4575c92d6d39f6a4186181d4a456de6b43ceb927a6fb0c342771ee",
  "segments": [
    {
      "score": 202,
      "cumulativeCount": 1
    },
    {
      "score": 200,
      "cumulativeCount": 2
    },
    {
      "score": 195,
      "cumulativeCount": 3
    },
    {
      "score": 188,
      "cumulativeCount": 4
    },
    {
      "score": 185,
      "cumulativeCount": 5
    },
    {
      "score": 184,
      "cumulativeCount": 6
    },
    {
      "score": 174,
      "cumulativeCount": 7
    },
    {
      "score": 168,
      "cumulativeCount": 8
    },
    {
      "score": 167,
      "cumulativeCount": 9
    },
    {
      "score": 160,
      "cumulativeCount": 10
    },
    {
      "score": 154,
      "cumulativeCount": 11
    },
    {
      "score": 153,
      "cumulativeCount": 12
    },
    {
      "score": 152,
      "cumulativeCount": 13
    },
    {
      "score": 144,
      "cumulativeCount": 14
    },
    {
      "score": 141,
      "cumulativeCount": 16
    },
    {
      "score": 139,
      "cumulativeCount": 17
    },
    {
      "score": 137,
      "cumulativeCount": 19
    },
    {
      "score": 136,
      "cumulativeCount": 21
    },
    {
      "score": 135,
      "cumulativeCount": 24
    },
    {
      "score": 134,
      "cumulativeCount": 26
    },
    {
      "score": 133,
      "cumulativeCount": 27
    },
    {
      "score": 132,
      "cumulativeCount": 29
    },
    {
      "score": 128,
      "cumulativeCount": 30
    },
    {
      "score": 123,
      "cumulativeCount": 31
    },
    {
      "score": 121,
      "cumulativeCount": 33
    },
    {
      "score": 120,
      "cumulativeCount": 35
    },
    {
      "score": 118,
      "cumulativeCount": 36
    },
    {
      "score": 116,
      "cumulativeCount": 38
    },
    {
      "score": 115,
      "cumulativeCount": 40
    },
    {
      "score": 114,
      "cumulativeCount": 41
    },
    {
      "score": 113,
      "cumulativeCount": 43
    },
    {
      "score": 112,
      "cumulativeCount": 44
    },
    {
      "score": 109,
      "cumulativeCount": 45
    },
    {
      "score": 108,
      "cumulativeCount": 47
    },
    {
      "score": 107,
      "cumulativeCount": 50
    },
    {
      "score": 106,
      "cumulativeCount": 51
    },
    {
      "score": 105,
      "cumulativeCount": 52
    },
    {
      "score": 103,
      "cumulativeCount": 54
    },
    {
      "score": 102,
      "cumulativeCount": 55
    },
    {
      "score": 101,
      "cumulativeCount": 56
    },
    {
      "score": 100,
      "cumulativeCount": 57
    },
    {
      "score": 99,
      "cumulativeCount": 58
    },
    {
      "score": 98,
      "cumulativeCount": 61
    },
    {
      "score": 97,
      "cumulativeCount": 62
    },
    {
      "score": 96,
      "cumulativeCount": 65
    },
    {
      "score": 95,
      "cumulativeCount": 69
    },
    {
      "score": 93,
      "cumulativeCount": 71
    },
    {
      "score": 92,
      "cumulativeCount": 73
    },
    {
      "score": 90,
      "cumulativeCount": 75
    },
    {
      "score": 89,
      "cumulativeCount": 76
    },
    {
      "score": 88,
      "cumulativeCount": 77
    },
    {
      "score": 87,
      "cumulativeCount": 81
    },
    {
      "score": 86,
      "cumulativeCount": 83
    },
    {
      "score": 85,
      "cumulativeCount": 87
    }
  ],
  "status": "ok",
  "issues": []
}
