{
  "majorCode": "H5",
  "majorName": "电缆工程",
  "controlScore": 122,
  "sourceId": "score-segments:2024:H5:fcc6404930a0",
  "sourcePdf": "一分一段/原始PDF/2024/H5_电缆工程.pdf",
  "sourceSha256": "fcc6404930a0f9a1a1a2de9fea8169ee88ff001ce5f2b9b59c03af2de8ff58f5",
  "segments": [
    {
      "score": 233,
      "cumulativeCount": 1
    },
    {
      "score": 230,
      "cumulativeCount": 2
    },
    {
      "score": 229,
      "cumulativeCount": 3
    },
    {
      "score": 220,
      "cumulativeCount": 5
    },
    {
      "score": 217,
      "cumulativeCount": 7
    },
    {
      "score": 214,
      "cumulativeCount": 9
    },
    {
      "score": 213,
      "cumulativeCount": 10
    },
    {
      "score": 212,
      "cumulativeCount": 11
    },
    {
      "score": 211,
      "cumulativeCount": 12
    },
    {
      "score": 210,
      "cumulativeCount": 13
    },
    {
      "score": 207,
      "cumulativeCount": 14
    },
    {
      "score": 205,
      "cumulativeCount": 15
    },
    {
      "score": 201,
      "cumulativeCount": 16
    },
    {
      "score": 200,
      "cumulativeCount": 17
    },
    {
      "score": 198,
      "cumulativeCount": 19
    },
    {
      "score": 196,
      "cumulativeCount": 21
    },
    {
      "score": 195,
      "cumulativeCount": 22
    },
    {
      "score": 194,
      "cumulativeCount": 25
    },
    {
      "score": 192,
      "cumulativeCount": 28
    },
    {
      "score": 191,
      "cumulativeCount": 30
    },
    {
      "score": 190,
      "cumulativeCount": 32
    },
    {
      "score": 189,
      "cumulativeCount": 37
    },
    {
      "score": 186,
      "cumulativeCount": 41
    },
    {
      "score": 185,
      "cumulativeCount": 43
    },
    {
      "score": 184,
      "cumulativeCount": 45
    },
    {
      "score": 183,
      "cumulativeCount": 48
    },
    {
      "score": 182,
      "cumulativeCount": 54
    },
    {
      "score": 181,
      "cumulativeCount": 56
    },
    {
      "score": 180,
      "cumulativeCount": 57
    },
    {
      "score": 179,
      "cumulativeCount": 60
    },
    {
      "score": 178,
      "cumulativeCount": 64
    },
    {
      "score": 177,
      "cumulativeCount": 66
    },
    {
      "score": 176,
      "cumulativeCount": 70
    },
    {
      "score": 175,
      "cumulativeCount": 72
    },
    {
      "score": 173,
      "cumulativeCount": 75
    },
    {
      "score": 172,
      "cumulativeCount": 77
    },
    {
      "score": 171,
      "cumulativeCount": 78
    },
    {
      "score": 170,
      "cumulativeCount": 81
    },
    {
      "score": 169,
      "cumulativeCount": 84
    },
    {
      "score": 168,
      "cumulativeCount": 87
    },
    {
      "score": 167,
      "cumulativeCount": 89
    },
    {
      "score": 166,
      "cumulativeCount": 91
    },
    {
      "score": 165,
      "cumulativeCount": 92
    },
    {
      "score": 164,
      "cumulativeCount": 95
    },
    {
      "score": 163,
      "cumulativeCount": 98
    },
    {
      "score": 162,
      "cumulativeCount": 103
    },
    {
      "score": 161,
      "cumulativeCount": 105
    },
    {
      "score": 160,
      "cumulativeCount": 107
    },
    {
      "score": 159,
      "cumulativeCount": 110
    },
    {
      "score": 158,
      "cumulativeCount": 114
    },
    {
      "score": 157,
      "cumulativeCount": 119
    },
    {
      "score": 156,
      "cumulativeCount": 120
    },
    {
      "score": 154,
      "cumulativeCount": 121
    },
    {
      "score": 153,
      "cumulativeCount": 123
    }
  ],
  "status": "ok",
  "issues": []
}
