{
  "majorCode": "75",
  "majorName": "食品科学与工程",
  "controlScore": 105,
  "sourceId": "score-segments:2025:75:0c82e0d82443",
  "sourcePdf": "一分一段/原始PDF/2025/75_食品科学与工程.pdf",
  "sourceSha256": "0c82e0d8244398531a4e6b9297fd3488f78a50ae611af2df4a9cb057b1c403e2",
  "segments": [
    {
      "score": 270,
      "cumulativeCount": 1
    },
    {
      "score": 268,
      "cumulativeCount": 2
    },
    {
      "score": 264,
      "cumulativeCount": 3
    },
    {
      "score": 257,
      "cumulativeCount": 4
    },
    {
      "score": 252,
      "cumulativeCount": 5
    },
    {
      "score": 245,
      "cumulativeCount": 6
    },
    {
      "score": 244,
      "cumulativeCount": 8
    },
    {
      "score": 243,
      "cumulativeCount": 9
    },
    {
      "score": 242,
      "cumulativeCount": 10
    },
    {
      "score": 241,
      "cumulativeCount": 12
    },
    {
      "score": 240,
      "cumulativeCount": 13
    },
    {
      "score": 239,
      "cumulativeCount": 18
    },
    {
      "score": 238,
      "cumulativeCount": 19
    },
    {
      "score": 237,
      "cumulativeCount": 21
    },
    {
      "score": 236,
      "cumulativeCount": 22
    },
    {
      "score": 235,
      "cumulativeCount": 24
    },
    {
      "score": 234,
      "cumulativeCount": 26
    },
    {
      "score": 233,
      "cumulativeCount": 27
    },
    {
      "score": 232,
      "cumulativeCount": 30
    },
    {
      "score": 231,
      "cumulativeCount": 32
    },
    {
      "score": 230,
      "cumulativeCount": 33
    },
    {
      "score": 229,
      "cumulativeCount": 35
    },
    {
      "score": 228,
      "cumulativeCount": 38
    },
    {
      "score": 227,
      "cumulativeCount": 40
    },
    {
      "score": 225,
      "cumulativeCount": 47
    },
    {
      "score": 224,
      "cumulativeCount": 51
    },
    {
      "score": 223,
      "cumulativeCount": 55
    },
    {
      "score": 222,
      "cumulativeCount": 57
    },
    {
      "score": 221,
      "cumulativeCount": 59
    },
    {
      "score": 220,
      "cumulativeCount": 62
    },
    {
      "score": 219,
      "cumulativeCount": 63
    },
    {
      "score": 218,
      "cumulativeCount": 66
    },
    {
      "score": 217,
      "cumulativeCount": 69
    },
    {
      "score": 216,
      "cumulativeCount": 71
    },
    {
      "score": 215,
      "cumulativeCount": 75
    },
    {
      "score": 214,
      "cumulativeCount": 78
    },
    {
      "score": 213,
      "cumulativeCount": 81
    },
    {
      "score": 212,
      "cumulativeCount": 84
    },
    {
      "score": 211,
      "cumulativeCount": 89
    },
    {
      "score": 210,
      "cumulativeCount": 92
    },
    {
      "score": 209,
      "cumulativeCount": 94
    },
    {
      "score": 208,
      "cumulativeCount": 97
    },
    {
      "score": 206,
      "cumulativeCount": 102
    },
    {
      "score": 205,
      "cumulativeCount": 104
    },
    {
      "score": 204,
      "cumulativeCount": 106
    },
    {
      "score": 203,
      "cumulativeCount": 110
    },
    {
      "score": 202,
      "cumulativeCount": 115
    },
    {
      "score": 201,
      "cumulativeCount": 117
    },
    {
      "score": 200,
      "cumulativeCount": 122
    },
    {
      "score": 199,
      "cumulativeCount": 124
    },
    {
      "score": 198,
      "cumulativeCount": 133
    },
    {
      "score": 197,
      "cumulativeCount": 135
    },
    {
      "score": 196,
      "cumulativeCount": 140
    },
    {
      "score": 195,
      "cumulativeCount": 143
    },
    {
      "score": 167,
      "cumulativeCount": 272
    },
    {
      "score": 166,
      "cumulativeCount": 276
    },
    {
      "score": 165,
      "cumulativeCount": 282
    },
    {
      "score": 164,
      "cumulativeCount": 285
    },
    {
      "score": 163,
      "cumulativeCount": 291
    },
    {
      "score": 162,
      "cumulativeCount": 295
    },
    {
      "score": 161,
      "cumulativeCount": 302
    },
    {
      "score": 160,
      "cumulativeCount": 303
    },
    {
      "score": 159,
      "cumulativeCount": 305
    },
    {
      "score": 158,
      "cumulativeCount": 311
    },
    {
      "score": 157,
      "cumulativeCount": 317
    },
    {
      "score": 156,
      "cumulativeCount": 319
    },
    {
      "score": 155,
      "cumulativeCount": 325
    },
    {
      "score": 154,
      "cumulativeCount": 339
    },
    {
      "score": 153,
      "cumulativeCount": 343
    },
    {
      "score": 152,
      "cumulativeCount": 348
    },
    {
      "score": 151,
      "cumulativeCount": 349
    },
    {
      "score": 150,
      "cumulativeCount": 352
    },
    {
      "score": 149,
      "cumulativeCount": 355
    },
    {
      "score": 148,
      "cumulativeCount": 358
    },
    {
      "score": 147,
      "cumulativeCount": 365
    },
    {
      "score": 146,
      "cumulativeCount": 367
    },
    {
      "score": 145,
      "cumulativeCount": 372
    },
    {
      "score": 144,
      "cumulativeCount": 377
    },
    {
      "score": 143,
      "cumulativeCount": 384
    },
    {
      "score": 142,
      "cumulativeCount": 388
    },
    {
      "score": 141,
      "cumulativeCount": 393
    },
    {
      "score": 140,
      "cumulativeCount": 397
    },
    {
      "score": 139,
      "cumulativeCount": 401
    },
    {
      "score": 138,
      "cumulativeCount": 404
    },
    {
      "score": 137,
      "cumulativeCount": 409
    },
    {
      "score": 136,
      "cumulativeCount": 414
    },
    {
      "score": 135,
      "cumulativeCount": 417
    },
    {
      "score": 134,
      "cumulativeCount": 420
    },
    {
      "score": 133,
      "cumulativeCount": 426
    },
    {
      "score": 132,
      "cumulativeCount": 429
    },
    {
      "score": 131,
      "cumulativeCount": 436
    },
    {
      "score": 130,
      "cumulativeCount": 442
    },
    {
      "score": 129,
      "cumulativeCount": 444
    },
    {
      "score": 128,
      "cumulativeCount": 447
    },
    {
      "score": 127,
      "cumulativeCount": 450
    },
    {
      "score": 126,
      "cumulativeCount": 456
    },
    {
      "score": 125,
      "cumulativeCount": 462
    },
    {
      "score": 124,
      "cumulativeCount": 469
    },
    {
      "score": 123,
      "cumulativeCount": 473
    },
    {
      "score": 122,
      "cumulativeCount": 478
    },
    {
      "score": 121,
      "cumulativeCount": 489
    },
    {
      "score": 120,
      "cumulativeCount": 494
    },
    {
      "score": 119,
      "cumulativeCount": 498
    },
    {
      "score": 118,
      "cumulativeCount": 503
    },
    {
      "score": 117,
      "cumulativeCount": 507
    },
    {
      "score": 116,
      "cumulativeCount": 513
    },
    {
      "score": 115,
      "cumulativeCount": 515
    },
    {
      "score": 114,
      "cumulativeCount": 523
    }
  ],
  "status": "ok",
  "issues": []
}
