{
  "majorCode": "B1",
  "majorName": "旅游管理",
  "controlScore": 83,
  "sourceId": "score-segments:2026:B1:331c2958bf02",
  "sourcePdf": "一分一段/原始PDF/2026/B1_旅游管理.pdf",
  "sourceSha256": "331c2958bf02b5f17575bb763782de12595664fed6e3226d9cfe8982b3002cb9",
  "segments": [
    {
      "score": 249,
      "cumulativeCount": 1
    },
    {
      "score": 244,
      "cumulativeCount": 3
    },
    {
      "score": 243,
      "cumulativeCount": 4
    },
    {
      "score": 241,
      "cumulativeCount": 5
    },
    {
      "score": 240,
      "cumulativeCount": 6
    },
    {
      "score": 239,
      "cumulativeCount": 7
    },
    {
      "score": 237,
      "cumulativeCount": 8
    },
    {
      "score": 236,
      "cumulativeCount": 11
    },
    {
      "score": 235,
      "cumulativeCount": 12
    },
    {
      "score": 234,
      "cumulativeCount": 14
    },
    {
      "score": 233,
      "cumulativeCount": 16
    },
    {
      "score": 232,
      "cumulativeCount": 17
    },
    {
      "score": 231,
      "cumulativeCount": 22
    },
    {
      "score": 230,
      "cumulativeCount": 25
    },
    {
      "score": 229,
      "cumulativeCount": 26
    },
    {
      "score": 228,
      "cumulativeCount": 30
    },
    {
      "score": 227,
      "cumulativeCount": 31
    },
    {
      "score": 226,
      "cumulativeCount": 34
    },
    {
      "score": 225,
      "cumulativeCount": 35
    },
    {
      "score": 224,
      "cumulativeCount": 38
    },
    {
      "score": 223,
      "cumulativeCount": 43
    },
    {
      "score": 222,
      "cumulativeCount": 50
    },
    {
      "score": 221,
      "cumulativeCount": 54
    },
    {
      "score": 220,
      "cumulativeCount": 58
    },
    {
      "score": 219,
      "cumulativeCount": 63
    },
    {
      "score": 218,
      "cumulativeCount": 68
    },
    {
      "score": 217,
      "cumulativeCount": 75
    },
    {
      "score": 216,
      "cumulativeCount": 80
    },
    {
      "score": 215,
      "cumulativeCount": 84
    },
    {
      "score": 214,
      "cumulativeCount": 94
    },
    {
      "score": 213,
      "cumulativeCount": 99
    },
    {
      "score": 212,
      "cumulativeCount": 104
    },
    {
      "score": 211,
      "cumulativeCount": 113
    },
    {
      "score": 210,
      "cumulativeCount": 120
    },
    {
      "score": 209,
      "cumulativeCount": 130
    },
    {
      "score": 208,
      "cumulativeCount": 138
    },
    {
      "score": 207,
      "cumulativeCount": 144
    },
    {
      "score": 206,
      "cumulativeCount": 151
    },
    {
      "score": 205,
      "cumulativeCount": 161
    },
    {
      "score": 204,
      "cumulativeCount": 176
    },
    {
      "score": 203,
      "cumulativeCount": 186
    },
    {
      "score": 202,
      "cumulativeCount": 195
    },
    {
      "score": 201,
      "cumulativeCount": 202
    },
    {
      "score": 200,
      "cumulativeCount": 206
    },
    {
      "score": 199,
      "cumulativeCount": 216
    },
    {
      "score": 198,
      "cumulativeCount": 226
    },
    {
      "score": 197,
      "cumulativeCount": 236
    },
    {
      "score": 196,
      "cumulativeCount": 240
    },
    {
      "score": 195,
      "cumulativeCount": 256
    },
    {
      "score": 194,
      "cumulativeCount": 265
    },
    {
      "score": 193,
      "cumulativeCount": 269
    },
    {
      "score": 192,
      "cumulativeCount": 277
    },
    {
      "score": 191,
      "cumulativeCount": 283
    },
    {
      "score": 190,
      "cumulativeCount": 292
    },
    {
      "score": 162,
      "cumulativeCount": 546
    },
    {
      "score": 161,
      "cumulativeCount": 555
    },
    {
      "score": 160,
      "cumulativeCount": 570
    },
    {
      "score": 159,
      "cumulativeCount": 578
    },
    {
      "score": 158,
      "cumulativeCount": 587
    },
    {
      "score": 157,
      "cumulativeCount": 600
    },
    {
      "score": 156,
      "cumulativeCount": 608
    },
    {
      "score": 155,
      "cumulativeCount": 616
    },
    {
      "score": 154,
      "cumulativeCount": 626
    },
    {
      "score": 153,
      "cumulativeCount": 634
    },
    {
      "score": 152,
      "cumulativeCount": 641
    },
    {
      "score": 151,
      "cumulativeCount": 652
    },
    {
      "score": 150,
      "cumulativeCount": 666
    },
    {
      "score": 149,
      "cumulativeCount": 672
    },
    {
      "score": 148,
      "cumulativeCount": 680
    },
    {
      "score": 147,
      "cumulativeCount": 686
    },
    {
      "score": 146,
      "cumulativeCount": 699
    },
    {
      "score": 145,
      "cumulativeCount": 711
    },
    {
      "score": 144,
      "cumulativeCount": 714
    },
    {
      "score": 143,
      "cumulativeCount": 719
    },
    {
      "score": 142,
      "cumulativeCount": 733
    },
    {
      "score": 141,
      "cumulativeCount": 742
    },
    {
      "score": 140,
      "cumulativeCount": 755
    },
    {
      "score": 139,
      "cumulativeCount": 766
    },
    {
      "score": 138,
      "cumulativeCount": 774
    },
    {
      "score": 137,
      "cumulativeCount": 793
    },
    {
      "score": 136,
      "cumulativeCount": 805
    },
    {
      "score": 135,
      "cumulativeCount": 815
    },
    {
      "score": 134,
      "cumulativeCount": 823
    },
    {
      "score": 133,
      "cumulativeCount": 833
    },
    {
      "score": 132,
      "cumulativeCount": 846
    },
    {
      "score": 131,
      "cumulativeCount": 856
    },
    {
      "score": 130,
      "cumulativeCount": 868
    },
    {
      "score": 129,
      "cumulativeCount": 883
    },
    {
      "score": 128,
      "cumulativeCount": 895
    },
    {
      "score": 127,
      "cumulativeCount": 908
    },
    {
      "score": 126,
      "cumulativeCount": 921
    },
    {
      "score": 125,
      "cumulativeCount": 930
    },
    {
      "score": 124,
      "cumulativeCount": 945
    },
    {
      "score": 123,
      "cumulativeCount": 959
    },
    {
      "score": 122,
      "cumulativeCount": 968
    },
    {
      "score": 121,
      "cumulativeCount": 978
    },
    {
      "score": 120,
      "cumulativeCount": 991
    },
    {
      "score": 119,
      "cumulativeCount": 1002
    },
    {
      "score": 118,
      "cumulativeCount": 1012
    },
    {
      "score": 117,
      "cumulativeCount": 1030
    },
    {
      "score": 116,
      "cumulativeCount": 1043
    },
    {
      "score": 115,
      "cumulativeCount": 1055
    },
    {
      "score": 114,
      "cumulativeCount": 1070
    },
    {
      "score": 113,
      "cumulativeCount": 1081
    },
    {
      "score": 112,
      "cumulativeCount": 1094
    },
    {
      "score": 111,
      "cumulativeCount": 1107
    },
    {
      "score": 110,
      "cumulativeCount": 1122
    },
    {
      "score": 109,
      "cumulativeCount": 1132
    }
  ],
  "status": "ok",
  "issues": []
}
