{
  "majorCode": "V5",
  "majorName": "非物质文化遗产保护",
  "controlScore": 143,
  "sourceId": "score-segments:2026:V5:9cbceb64fc3d",
  "sourcePdf": "一分一段/原始PDF/2026/V5_非物质文化遗产保护.pdf",
  "sourceSha256": "9cbceb64fc3d2f47100a4d69a47b2f1ead5eaad2c2553be3381fdadcb9ef4481",
  "segments": [
    {
      "score": 222,
      "cumulativeCount": 2
    },
    {
      "score": 208,
      "cumulativeCount": 3
    },
    {
      "score": 207,
      "cumulativeCount": 4
    },
    {
      "score": 206,
      "cumulativeCount": 5
    },
    {
      "score": 203,
      "cumulativeCount": 6
    },
    {
      "score": 199,
      "cumulativeCount": 8
    },
    {
      "score": 198,
      "cumulativeCount": 9
    },
    {
      "score": 197,
      "cumulativeCount": 10
    },
    {
      "score": 196,
      "cumulativeCount": 14
    },
    {
      "score": 194,
      "cumulativeCount": 15
    },
    {
      "score": 190,
      "cumulativeCount": 16
    },
    {
      "score": 188,
      "cumulativeCount": 17
    },
    {
      "score": 187,
      "cumulativeCount": 21
    },
    {
      "score": 186,
      "cumulativeCount": 22
    },
    {
      "score": 185,
      "cumulativeCount": 25
    },
    {
      "score": 184,
      "cumulativeCount": 26
    },
    {
      "score": 182,
      "cumulativeCount": 27
    },
    {
      "score": 179,
      "cumulativeCount": 29
    },
    {
      "score": 178,
      "cumulativeCount": 31
    },
    {
      "score": 177,
      "cumulativeCount": 34
    },
    {
      "score": 175,
      "cumulativeCount": 37
    },
    {
      "score": 174,
      "cumulativeCount": 39
    },
    {
      "score": 173,
      "cumulativeCount": 41
    },
    {
      "score": 172,
      "cumulativeCount": 42
    },
    {
      "score": 171,
      "cumulativeCount": 44
    },
    {
      "score": 170,
      "cumulativeCount": 46
    },
    {
      "score": 169,
      "cumulativeCount": 47
    },
    {
      "score": 168,
      "cumulativeCount": 51
    },
    {
      "score": 167,
      "cumulativeCount": 53
    },
    {
      "score": 166,
      "cumulativeCount": 57
    },
    {
      "score": 164,
      "cumulativeCount": 60
    },
    {
      "score": 163,
      "cumulativeCount": 63
    },
    {
      "score": 162,
      "cumulativeCount": 64
    },
    {
      "score": 161,
      "cumulativeCount": 68
    },
    {
      "score": 159,
      "cumulativeCount": 70
    },
    {
      "score": 158,
      "cumulativeCount": 75
    },
    {
      "score": 157,
      "cumulativeCount": 78
    },
    {
      "score": 156,
      "cumulativeCount": 79
    },
    {
      "score": 154,
      "cumulativeCount": 81
    },
    {
      "score": 153,
      "cumulativeCount": 85
    },
    {
      "score": 152,
      "cumulativeCount": 86
    },
    {
      "score": 151,
      "cumulativeCount": 87
    },
    {
      "score": 150,
      "cumulativeCount": 88
    },
    {
      "score": 149,
      "cumulativeCount": 89
    },
    {
      "score": 148,
      "cumulativeCount": 92
    },
    {
      "score": 146,
      "cumulativeCount": 93
    },
    {
      "score": 145,
      "cumulativeCount": 95
    },
    {
      "score": 144,
      "cumulativeCount": 97
    },
    {
      "score": 143,
      "cumulativeCount": 98
    }
  ],
  "status": "ok",
  "issues": []
}
