{
  "majorCode": "K6",
  "majorName": "家政学",
  "controlScore": 97,
  "sourceId": "score-segments:2026:K6:b553e92be4e8",
  "sourcePdf": "一分一段/原始PDF/2026/K6_家政学.pdf",
  "sourceSha256": "b553e92be4e8c586e9b973622280d4604cac0482858cca6eb6073cea1dd7b404",
  "segments": [
    {
      "score": 231,
      "cumulativeCount": 1
    },
    {
      "score": 225,
      "cumulativeCount": 2
    },
    {
      "score": 218,
      "cumulativeCount": 3
    },
    {
      "score": 216,
      "cumulativeCount": 4
    },
    {
      "score": 213,
      "cumulativeCount": 5
    },
    {
      "score": 209,
      "cumulativeCount": 6
    },
    {
      "score": 206,
      "cumulativeCount": 8
    },
    {
      "score": 202,
      "cumulativeCount": 9
    },
    {
      "score": 201,
      "cumulativeCount": 11
    },
    {
      "score": 200,
      "cumulativeCount": 12
    },
    {
      "score": 198,
      "cumulativeCount": 13
    },
    {
      "score": 197,
      "cumulativeCount": 15
    },
    {
      "score": 196,
      "cumulativeCount": 17
    },
    {
      "score": 195,
      "cumulativeCount": 18
    },
    {
      "score": 192,
      "cumulativeCount": 19
    },
    {
      "score": 187,
      "cumulativeCount": 22
    },
    {
      "score": 185,
      "cumulativeCount": 23
    },
    {
      "score": 184,
      "cumulativeCount": 26
    },
    {
      "score": 182,
      "cumulativeCount": 31
    },
    {
      "score": 181,
      "cumulativeCount": 34
    },
    {
      "score": 179,
      "cumulativeCount": 35
    },
    {
      "score": 178,
      "cumulativeCount": 38
    },
    {
      "score": 177,
      "cumulativeCount": 39
    },
    {
      "score": 176,
      "cumulativeCount": 43
    },
    {
      "score": 175,
      "cumulativeCount": 44
    },
    {
      "score": 174,
      "cumulativeCount": 46
    },
    {
      "score": 173,
      "cumulativeCount": 47
    },
    {
      "score": 171,
      "cumulativeCount": 49
    },
    {
      "score": 170,
      "cumulativeCount": 50
    },
    {
      "score": 169,
      "cumulativeCount": 51
    },
    {
      "score": 168,
      "cumulativeCount": 54
    },
    {
      "score": 167,
      "cumulativeCount": 55
    },
    {
      "score": 166,
      "cumulativeCount": 57
    },
    {
      "score": 165,
      "cumulativeCount": 59
    },
    {
      "score": 164,
      "cumulativeCount": 61
    },
    {
      "score": 162,
      "cumulativeCount": 63
    },
    {
      "score": 160,
      "cumulativeCount": 64
    },
    {
      "score": 159,
      "cumulativeCount": 66
    },
    {
      "score": 158,
      "cumulativeCount": 67
    },
    {
      "score": 156,
      "cumulativeCount": 71
    },
    {
      "score": 155,
      "cumulativeCount": 76
    },
    {
      "score": 154,
      "cumulativeCount": 78
    },
    {
      "score": 152,
      "cumulativeCount": 79
    },
    {
      "score": 151,
      "cumulativeCount": 80
    },
    {
      "score": 150,
      "cumulativeCount": 82
    },
    {
      "score": 146,
      "cumulativeCount": 83
    },
    {
      "score": 145,
      "cumulativeCount": 86
    },
    {
      "score": 144,
      "cumulativeCount": 87
    },
    {
      "score": 143,
      "cumulativeCount": 88
    },
    {
      "score": 142,
      "cumulativeCount": 92
    },
    {
      "score": 141,
      "cumulativeCount": 94
    },
    {
      "score": 140,
      "cumulativeCount": 95
    },
    {
      "score": 139,
      "cumulativeCount": 96
    },
    {
      "score": 138,
      "cumulativeCount": 98
    },
    {
      "score": 106,
      "cumulativeCount": 176
    },
    {
      "score": 104,
      "cumulativeCount": 179
    },
    {
      "score": 103,
      "cumulativeCount": 181
    },
    {
      "score": 102,
      "cumulativeCount": 183
    },
    {
      "score": 101,
      "cumulativeCount": 184
    },
    {
      "score": 100,
      "cumulativeCount": 185
    },
    {
      "score": 99,
      "cumulativeCount": 191
    },
    {
      "score": 98,
      "cumulativeCount": 194
    },
    {
      "score": 97,
      "cumulativeCount": 196
    }
  ],
  "status": "ok",
  "issues": []
}
