{
  "majorCode": "86",
  "majorName": "茶学",
  "controlScore": 124,
  "sourceId": "score-segments:2025:86:b93172246fea",
  "sourcePdf": "一分一段/原始PDF/2025/86_茶学.pdf",
  "sourceSha256": "b93172246fea567c9fd222a401c0ab894ec80fbbdea4a3870d5a0d2402eac4fe",
  "segments": [
    {
      "score": 242,
      "cumulativeCount": 1
    },
    {
      "score": 240,
      "cumulativeCount": 2
    },
    {
      "score": 234,
      "cumulativeCount": 3
    },
    {
      "score": 223,
      "cumulativeCount": 4
    },
    {
      "score": 222,
      "cumulativeCount": 5
    },
    {
      "score": 221,
      "cumulativeCount": 6
    },
    {
      "score": 212,
      "cumulativeCount": 7
    },
    {
      "score": 208,
      "cumulativeCount": 8
    },
    {
      "score": 205,
      "cumulativeCount": 12
    },
    {
      "score": 204,
      "cumulativeCount": 13
    },
    {
      "score": 202,
      "cumulativeCount": 14
    },
    {
      "score": 201,
      "cumulativeCount": 15
    },
    {
      "score": 199,
      "cumulativeCount": 17
    },
    {
      "score": 198,
      "cumulativeCount": 18
    },
    {
      "score": 197,
      "cumulativeCount": 19
    },
    {
      "score": 194,
      "cumulativeCount": 20
    },
    {
      "score": 193,
      "cumulativeCount": 21
    },
    {
      "score": 192,
      "cumulativeCount": 22
    },
    {
      "score": 190,
      "cumulativeCount": 23
    },
    {
      "score": 189,
      "cumulativeCount": 25
    },
    {
      "score": 187,
      "cumulativeCount": 26
    },
    {
      "score": 186,
      "cumulativeCount": 27
    },
    {
      "score": 185,
      "cumulativeCount": 28
    },
    {
      "score": 183,
      "cumulativeCount": 29
    },
    {
      "score": 182,
      "cumulativeCount": 30
    },
    {
      "score": 181,
      "cumulativeCount": 32
    },
    {
      "score": 180,
      "cumulativeCount": 33
    },
    {
      "score": 178,
      "cumulativeCount": 34
    },
    {
      "score": 176,
      "cumulativeCount": 36
    },
    {
      "score": 175,
      "cumulativeCount": 38
    },
    {
      "score": 174,
      "cumulativeCount": 39
    },
    {
      "score": 172,
      "cumulativeCount": 40
    },
    {
      "score": 168,
      "cumulativeCount": 41
    },
    {
      "score": 166,
      "cumulativeCount": 44
    },
    {
      "score": 164,
      "cumulativeCount": 45
    },
    {
      "score": 163,
      "cumulativeCount": 47
    },
    {
      "score": 162,
      "cumulativeCount": 48
    },
    {
      "score": 161,
      "cumulativeCount": 49
    },
    {
      "score": 160,
      "cumulativeCount": 50
    },
    {
      "score": 158,
      "cumulativeCount": 51
    },
    {
      "score": 157,
      "cumulativeCount": 52
    },
    {
      "score": 155,
      "cumulativeCount": 53
    },
    {
      "score": 154,
      "cumulativeCount": 54
    },
    {
      "score": 152,
      "cumulativeCount": 55
    },
    {
      "score": 151,
      "cumulativeCount": 56
    },
    {
      "score": 150,
      "cumulativeCount": 58
    },
    {
      "score": 148,
      "cumulativeCount": 59
    },
    {
      "score": 147,
      "cumulativeCount": 60
    },
    {
      "score": 145,
      "cumulativeCount": 61
    },
    {
      "score": 144,
      "cumulativeCount": 62
    },
    {
      "score": 143,
      "cumulativeCount": 63
    },
    {
      "score": 142,
      "cumulativeCount": 64
    },
    {
      "score": 140,
      "cumulativeCount": 65
    },
    {
      "score": 139,
      "cumulativeCount": 66
    }
  ],
  "status": "ok",
  "issues": []
}
