{
  "majorCode": "H9",
  "majorName": "智能制造工程（含智能制造工程技术）",
  "controlScore": 108,
  "sourceId": "score-segments:2026:H9:91fd2547d456",
  "sourcePdf": "一分一段/原始PDF/2026/H9_智能制造工程.pdf",
  "sourceSha256": "91fd2547d456231615f52c3522bfcebd9304b4b267826aec764dd4ad63d77e88",
  "segments": [
    {
      "score": 237,
      "cumulativeCount": 1
    },
    {
      "score": 233,
      "cumulativeCount": 2
    },
    {
      "score": 231,
      "cumulativeCount": 3
    },
    {
      "score": 229,
      "cumulativeCount": 4
    },
    {
      "score": 223,
      "cumulativeCount": 5
    },
    {
      "score": 222,
      "cumulativeCount": 6
    },
    {
      "score": 220,
      "cumulativeCount": 8
    },
    {
      "score": 219,
      "cumulativeCount": 10
    },
    {
      "score": 215,
      "cumulativeCount": 13
    },
    {
      "score": 214,
      "cumulativeCount": 15
    },
    {
      "score": 212,
      "cumulativeCount": 16
    },
    {
      "score": 211,
      "cumulativeCount": 18
    },
    {
      "score": 210,
      "cumulativeCount": 22
    },
    {
      "score": 209,
      "cumulativeCount": 24
    },
    {
      "score": 208,
      "cumulativeCount": 25
    },
    {
      "score": 207,
      "cumulativeCount": 26
    },
    {
      "score": 206,
      "cumulativeCount": 28
    },
    {
      "score": 205,
      "cumulativeCount": 31
    },
    {
      "score": 203,
      "cumulativeCount": 32
    },
    {
      "score": 202,
      "cumulativeCount": 33
    },
    {
      "score": 201,
      "cumulativeCount": 35
    },
    {
      "score": 200,
      "cumulativeCount": 36
    },
    {
      "score": 199,
      "cumulativeCount": 39
    },
    {
      "score": 198,
      "cumulativeCount": 40
    },
    {
      "score": 197,
      "cumulativeCount": 42
    },
    {
      "score": 196,
      "cumulativeCount": 43
    },
    {
      "score": 194,
      "cumulativeCount": 47
    },
    {
      "score": 193,
      "cumulativeCount": 50
    },
    {
      "score": 192,
      "cumulativeCount": 51
    },
    {
      "score": 191,
      "cumulativeCount": 56
    },
    {
      "score": 190,
      "cumulativeCount": 60
    },
    {
      "score": 188,
      "cumulativeCount": 69
    },
    {
      "score": 187,
      "cumulativeCount": 71
    },
    {
      "score": 186,
      "cumulativeCount": 79
    },
    {
      "score": 185,
      "cumulativeCount": 80
    },
    {
      "score": 184,
      "cumulativeCount": 84
    },
    {
      "score": 183,
      "cumulativeCount": 87
    },
    {
      "score": 182,
      "cumulativeCount": 97
    },
    {
      "score": 181,
      "cumulativeCount": 100
    },
    {
      "score": 180,
      "cumulativeCount": 103
    },
    {
      "score": 179,
      "cumulativeCount": 104
    },
    {
      "score": 178,
      "cumulativeCount": 106
    },
    {
      "score": 177,
      "cumulativeCount": 110
    },
    {
      "score": 176,
      "cumulativeCount": 112
    },
    {
      "score": 175,
      "cumulativeCount": 115
    },
    {
      "score": 174,
      "cumulativeCount": 118
    },
    {
      "score": 173,
      "cumulativeCount": 124
    },
    {
      "score": 172,
      "cumulativeCount": 127
    },
    {
      "score": 171,
      "cumulativeCount": 130
    },
    {
      "score": 170,
      "cumulativeCount": 132
    },
    {
      "score": 169,
      "cumulativeCount": 135
    },
    {
      "score": 168,
      "cumulativeCount": 138
    },
    {
      "score": 167,
      "cumulativeCount": 140
    },
    {
      "score": 166,
      "cumulativeCount": 145
    },
    {
      "score": 138,
      "cumulativeCount": 252
    },
    {
      "score": 137,
      "cumulativeCount": 258
    },
    {
      "score": 136,
      "cumulativeCount": 263
    },
    {
      "score": 135,
      "cumulativeCount": 265
    },
    {
      "score": 134,
      "cumulativeCount": 270
    },
    {
      "score": 133,
      "cumulativeCount": 274
    },
    {
      "score": 132,
      "cumulativeCount": 276
    },
    {
      "score": 131,
      "cumulativeCount": 281
    },
    {
      "score": 130,
      "cumulativeCount": 282
    },
    {
      "score": 129,
      "cumulativeCount": 285
    },
    {
      "score": 128,
      "cumulativeCount": 287
    },
    {
      "score": 126,
      "cumulativeCount": 290
    },
    {
      "score": 125,
      "cumulativeCount": 292
    },
    {
      "score": 124,
      "cumulativeCount": 296
    },
    {
      "score": 123,
      "cumulativeCount": 297
    },
    {
      "score": 122,
      "cumulativeCount": 298
    },
    {
      "score": 121,
      "cumulativeCount": 299
    },
    {
      "score": 120,
      "cumulativeCount": 302
    },
    {
      "score": 119,
      "cumulativeCount": 306
    },
    {
      "score": 118,
      "cumulativeCount": 307
    },
    {
      "score": 117,
      "cumulativeCount": 308
    },
    {
      "score": 115,
      "cumulativeCount": 309
    },
    {
      "score": 114,
      "cumulativeCount": 311
    },
    {
      "score": 113,
      "cumulativeCount": 313
    },
    {
      "score": 112,
      "cumulativeCount": 315
    },
    {
      "score": 111,
      "cumulativeCount": 318
    },
    {
      "score": 110,
      "cumulativeCount": 322
    },
    {
      "score": 109,
      "cumulativeCount": 324
    },
    {
      "score": 108,
      "cumulativeCount": 327
    }
  ],
  "status": "ok",
  "issues": []
}
