{
  "majorCode": "V9",
  "majorName": "传播学",
  "controlScore": 135,
  "sourceId": "score-segments:2026:V9:31d0d0226b2f",
  "sourcePdf": "一分一段/原始PDF/2026/V9_传播学.pdf",
  "sourceSha256": "31d0d0226b2fc572b05ec138fa03a8ea048df6bb42fa23d2b38984fc5992c293",
  "segments": [
    {
      "score": 174,
      "cumulativeCount": 1
    },
    {
      "score": 172,
      "cumulativeCount": 2
    },
    {
      "score": 167,
      "cumulativeCount": 3
    },
    {
      "score": 164,
      "cumulativeCount": 4
    },
    {
      "score": 159,
      "cumulativeCount": 5
    },
    {
      "score": 158,
      "cumulativeCount": 6
    },
    {
      "score": 151,
      "cumulativeCount": 8
    },
    {
      "score": 149,
      "cumulativeCount": 9
    },
    {
      "score": 138,
      "cumulativeCount": 10
    },
    {
      "score": 136,
      "cumulativeCount": 12
    },
    {
      "score": 135,
      "cumulativeCount": 14
    }
  ],
  "status": "ok",
  "issues": []
}
