{
  "majorCode": "P7",
  "majorName": "心理学",
  "controlScore": 132,
  "sourceId": "score-segments:2024:P7:323063afad49",
  "sourcePdf": "一分一段/原始PDF/2024/P7_心理学.pdf",
  "sourceSha256": "323063afad4939705e40e7b5e08ecef0c2d3fec860ea081add7433c60c577b35",
  "segments": [
    {
      "score": 202,
      "cumulativeCount": 1
    },
    {
      "score": 191,
      "cumulativeCount": 2
    },
    {
      "score": 187,
      "cumulativeCount": 3
    },
    {
      "score": 168,
      "cumulativeCount": 4
    },
    {
      "score": 166,
      "cumulativeCount": 5
    },
    {
      "score": 158,
      "cumulativeCount": 6
    },
    {
      "score": 156,
      "cumulativeCount": 8
    },
    {
      "score": 155,
      "cumulativeCount": 9
    },
    {
      "score": 150,
      "cumulativeCount": 10
    },
    {
      "score": 149,
      "cumulativeCount": 11
    },
    {
      "score": 140,
      "cumulativeCount": 12
    },
    {
      "score": 137,
      "cumulativeCount": 14
    },
    {
      "score": 136,
      "cumulativeCount": 15
    },
    {
      "score": 132,
      "cumulativeCount": 16
    }
  ],
  "status": "ok",
  "issues": []
}
